{
  "$schema": "https://json-schema.org/draft/2020-12/schema",
  "$id": "https://veritrust.vc/schemas/mcpservercredential.json",
  "title": "MCPServerCredential",
  "type": "object",
  "required": [
    "@context",
    "type",
    "issuer",
    "issuedAt",
    "validUntil",
    "credentialSubject"
  ],
  "properties": {
    "@context": {
      "type": "array",
      "items": {
        "type": "string",
        "format": "uri"
      },
      "minItems": 1
    },
    "type": {
      "type": "array",
      "minItems": 1,
      "items": {
        "type": "string"
      },
      "contains": {
        "const": "VerifiableCredential"
      }
    },
    "issuer": {
      "type": "string"
    },
    "issuedAt": {
      "type": "string",
      "format": "date-time"
    },
    "validUntil": {
      "type": "string",
      "format": "date-time"
    },
    "credentialSubject": {
      "type": "object",
      "required": [
        "id",
        "operator",
        "endpoint",
        "manifest",
        "capabilities",
        "assuranceLevel"
      ],
      "properties": {
        "id": {
          "type": "string",
          "description": "DID of the MCP server"
        },
        "operator": {
          "type": "string",
          "description": "Name of the organization operating the server"
        },
        "endpoint": {
          "type": "string",
          "format": "uri",
          "description": "MCP endpoint URL"
        },
        "manifest": {
          "type": "string",
          "format": "uri",
          "description": "URL to MCP manifest JSON"
        },
        "capabilities": {
          "type": "array",
          "items": {
            "type": "string"
          },
          "description": "List of capabilities exposed by the MCP server"
        },
        "assuranceLevel": {
          "type": "string",
          "enum": ["basic", "verified", "certified"],
          "description": "Assurance level assigned by the issuer"
        }
      },
      "additionalProperties": true
    },
    "proof": {
      "type": "object",
      "description": "Cryptographic proof object, structure depends on VC proof suite",
      "additionalProperties": true
    }
  },
  "additionalProperties": true
}
