{
  "@context": [
    "https://www.w3.org/ns/credentials/v2",
    "https://veritrust.vc/mcp/context.json"
  ],
  "type": [
    "VerifiableCredential",
    "MCPServerCredential"
  ],
  "issuer": "did:web:veritrust.vc",
  "issuedAt": "2025-11-01T00:00:00Z",
  "validUntil": "2027-11-01T00:00:00Z",
  "credentialSubject": {
    "id": "did:web:veritrust.vc:mcp:edgeguard-siem",
    "operator": "Cyberfort SIA",
    "endpoint": "https://edgeguard.cyberfort.lv/mcp",
    "manifest": "https://edgeguard.cyberfort.lv/mcp/manifest.json",
    "capabilities": [
      "telemetry",
      "alerts",
      "status"
    ],
    "assuranceLevel": "verified"
  },
  "proof": {
    "type": "Ed25519Signature2020",
    "created": "2025-11-01T00:00:00Z",
    "verificationMethod": "did:web:veritrust.vc#key-1",
    "proofPurpose": "assertionMethod",
    "proofValue": "zMockSignatureBase58OrMultibaseValue"
  }
}
